[
  {
    "candidate": {
      "title": "Höjd a-kassa till 90 procent av lönen",
      "parties": [
        "s"
      ],
      "person": {
        "name": "Magdalena Andersson",
        "role": "partiledare"
      },
      "quote": "Vi lovar att höja a-kassan till 90 procent av lönen från år 2027 för alla förvärvsarbetande.",
      "category": "välfärd",
      "amount_in_text_msek": 12000,
      "financing_mentioned": false
    },
    "failures": [],
    "articleUrl": "https://www.dn.se/sverige/s-hojd-akassa-2027/",
    "articleTitle": "S vill höja a-kassan till 90 procent av lönen",
    "cost": {
      "type": "utgift",
      "period": "engang",
      "msek_low": 9000,
      "msek_base": 12000,
      "msek_high": 16200,
      "basis": "parti",
      "basis_url": null,
      "method_note": "Belopp angivet i källtext; källan anger ingen takt — perioden måste avgöras av en människa.",
      "calculation": "Partiet anger själv beloppet i källtexten: 12 000 miljoner kronor. Den siffran är partiets och byts inte ut mot en egen. Spannet är vårt, inte partiets: 9 000–16 200 miljoner kronor, en fjärdedel under och drygt en tredjedel över partiets siffra. Det står för att källtexten anger en nivå utan att skriva ut hur den fasas in eller fördelas över åren. Källan säger inte om beloppet återkommer varje år eller gäller en gång. Takten är därför inte satt av oss, utan lämnad till den som granskar posten.",
      "confidence": 0.5
    },
    "costReason": "Låg kostnadssäkerhet: 0.5"
  },
  {
    "candidate": {
      "title": "Avskaffa vinstsyfte i välfärden",
      "parties": [
        "v"
      ],
      "person": null,
      "quote": "Vi kräver att vinstdrivande välfärd avskaffas helt och att alla välfärdstjänster drivs i allmän regi.",
      "category": "välfärd",
      "amount_in_text_msek": 5000,
      "financing_mentioned": false
    },
    "failures": [],
    "articleUrl": "https://www.svd.se/a/v-avskaffa-vinstsyfte-valfarden/",
    "articleTitle": "V vill avskaffa vinstsyfte i välfärden",
    "cost": {
      "type": "utgift",
      "period": "engang",
      "msek_low": 3750,
      "msek_base": 5000,
      "msek_high": 6750,
      "basis": "parti",
      "basis_url": null,
      "method_note": "Belopp angivet i källtext; källan anger ingen takt — perioden måste avgöras av en människa.",
      "calculation": "Partiet anger själv beloppet i källtexten: 5 000 miljoner kronor. Den siffran är partiets och byts inte ut mot en egen. Spannet är vårt, inte partiets: 3 750–6 750 miljoner kronor, en fjärdedel under och drygt en tredjedel över partiets siffra. Det står för att källtexten anger en nivå utan att skriva ut hur den fasas in eller fördelas över åren. Källan säger inte om beloppet återkommer varje år eller gäller en gång. Takten är därför inte satt av oss, utan lämnad till den som granskar posten.",
      "confidence": 0.5
    },
    "costReason": "Låg kostnadssäkerhet: 0.5"
  },
  {
    "candidate": {
      "title": "Permanent höjning av försvarsanslaget med 40 mdkr per år",
      "parties": [
        "m"
      ],
      "person": null,
      "quote": "Vi föreslår en permanent höjning av försvarsanslaget med 40 miljarder kronor per år fram till 2030.",
      "category": "försvar",
      "amount_in_text_msek": 40000,
      "financing_mentioned": false
    },
    "failures": [],
    "articleUrl": "https://www.svt.se/nyheter/m-forsvarsanslag-2027/",
    "articleTitle": "M vill höja försvarsanslaget med 40 miljarder per år",
    "cost": {
      "type": "utgift",
      "period": "per_ar",
      "msek_low": 30000,
      "msek_base": 40000,
      "msek_high": 54000,
      "basis": "parti",
      "basis_url": null,
      "method_note": "Belopp angivet i källtext.",
      "calculation": "Partiet anger själv beloppet i källtexten: 40 000 miljoner kronor. Den siffran är partiets och byts inte ut mot en egen. Spannet är vårt, inte partiets: 30 000–54 000 miljoner kronor, en fjärdedel under och drygt en tredjedel över partiets siffra. Det står för att källtexten anger en nivå utan att skriva ut hur den fasas in eller fördelas över åren.",
      "confidence": 0.7
    },
    "costReason": "Belopp ur källtexten (parti) — bekräfta belopp och period"
  }
]
